{
  "$schema": "https://tinyzkp.com/schemas/tinyzkp-platform-rollout.schema.json",
  "name": "TinyZKP Platform Rollout",
  "url": "https://tinyzkp.com/platform-rollout",
  "generated_at": "2026-06-24",
  "summary": "Sales-assisted rollout package for agent platforms, workflow engines, IDEs, and marketplaces that want TinyZKP proof receipts as a native policy surface.",
  "audience": [
    "Agent platforms",
    "Agent IDEs",
    "Workflow engines",
    "Agent marketplaces",
    "Automation platforms with high-value state-changing tool calls"
  ],
  "commercial_model": {
    "starting_package": "From $499/month committed minimum plus usage after pilot or design review.",
    "recommended_first_step": "$5,000 production pilot for one scoped workflow, creditable toward annual or reserved-capacity agreement if converted within 60 days.",
    "usage_model": "Self-serve proof receipt and Compute usage rates apply unless a reserved-capacity agreement supersedes them.",
    "verification": "Receipt verification is free for recipients."
  },
  "offer": {
    "primary_outcome": "Launch one receipt-required tool category with a clear TinyZKP proof statement, verifier path, receipt envelope, support expectation, and expansion plan.",
    "included": [
      "Receipt policy design for one platform tool category or workflow checkpoint",
      "MCP and REST integration guidance",
      "Receipt envelope and schema guidance for agent outputs, logs, dashboards, and audit records",
      "Verifier placement and user-facing copy review",
      "Spend-control, support-path, and launch-readiness review"
    ],
    "not_included_by_default": [
      "Generic private-input zero-knowledge claims",
      "Arbitrary zkVM execution",
      "Finished zkML inference proofs",
      "Custom proof systems outside the supported TinyZKP receipt boundary"
    ]
  },
  "rollout_phases": [
    {
      "phase": "select_category",
      "goal": "Pick one high-value action class where receipt evidence replaces weak logs, screenshots, approvals, or manual reconciliation."
    },
    {
      "phase": "production_pilot",
      "goal": "Use the $5,000 pilot to prove one real workflow, receipt statement, verifier path, and cost range."
    },
    {
      "phase": "platform_launch",
      "goal": "Expose receipt-required behavior in product UI, agent policy, logs, marketplace requirements, or customer dashboards."
    },
    {
      "phase": "expansion",
      "goal": "Add adjacent tool categories, customer-facing receipt surfaces, audit exports, reserved capacity, or Compute planning."
    }
  ],
  "distribution_hooks": [
    "Receipt-required policy for durable state-changing agent actions",
    "Receipt URL shown beside agent output, logs, workflow checkpoints, or customer dashboards",
    "Agent marketplace category requirement for payments, records, permissions, quotas, and compliance state",
    "Free verification for customers, auditors, counterparties, and downstream agents",
    "Machine-readable receipt envelopes for agent-to-agent handoffs"
  ],
  "technical_requirements": [
    "MCP or REST integration path for prove, poll, fetch, summarize, and verify operations",
    "Supported receipt statement or pilot-reviewed custom statement",
    "No secrets, API keys, or private customer data in transparent receipt parameters",
    "Storage of proof job IDs or receipt URLs beside platform workflow checkpoints",
    "Verifier URL or receipt envelope returned with the final agent output"
  ],
  "success_metrics": [
    "One receipt-required category launches with clear user-facing value",
    "Recipients can verify without an API key",
    "Receipt cost and monthly caps are understood before production expansion",
    "Support and escalation path are agreed before customer-visible rollout",
    "Adjacent receipt categories are identified after the first category proves value"
  ],
  "links": {
    "page": "https://tinyzkp.com/platform-rollout",
    "metadata": "https://tinyzkp.com/platform-rollout.json",
    "schema": "https://tinyzkp.com/schemas/tinyzkp-platform-rollout.schema.json",
    "agent_platforms": "https://tinyzkp.com/agent-platforms",
    "paid_pilot": "https://tinyzkp.com/pilot",
    "contact_platform_rollout": "https://tinyzkp.com/contact?category=Platform%20Rollout",
    "pricing": "https://tinyzkp.com/pricing",
    "pricing_metadata": "https://tinyzkp.com/pricing.json",
    "mcp": "https://tinyzkp.com/mcp",
    "agent_policy": "https://tinyzkp.com/agent-policy",
    "enterprise": "https://tinyzkp.com/enterprise"
  }
}
